;Наименование агента;Тип агента;Юридический адрес;ИНН;КПП;Директор;Телефон агента;Электронная почта агента;Логотип агента;Приоритет
94;ЭлектроITITСбыт;3;855489, Вологодская область, город Серебряные Пруды, пл. Ломоносова, 57;1532104861;112607081;Якушеваа Варвара Романовна;(812) 326-15-27;eliseeva.sofy@gorskov.net;\agents\agent_23.png;452
95;ЛенХозМясБанк;4;702413, Саратовская область, город Люберцы, въезд Чехова, 15;9266199692;335770867;Арсений Алексеевич Виноградова;(35222) 26-15-93;bobrov.viktor@kazakova.ru;\agents\agent_31.png;17
96;ЭлектроМоторТрансСнос;5;913777, Самарская область, город Красногорск, ул. Бухарестская, 49;6608362851;799760512;Людмила Евгеньевна Новиковаа;(495) 951-23-53;inessa.voronov@sidorova.ru;\agents\agent_98.png;151
97;Компания СервисРадиоГор;2;547196, Ульяновская область, город Серебряные Пруды, въезд Балканская, 81;8880473721;729975116;Попов Вадим Александрович;(812) 871-21-15;nika.nekrasova@kovalev.ru;\agents\agent_65.png;169
98;Компания МясДизайнДизайн;2;557264, Брянская область, город Серпухов, въезд Гоголя, 34;8004989990;908629456;Клементина Сергеевна Стрелкова;(495) 752-21-98;gleb.gulyev@belyeva.com;\agents\agent_78.png;491
99;БашкирФлотМотор-H;4;008081, Тюменская область, город Ногинск, въезд Гагарина, 94;1657476072;934931159;Марат Алексеевич Фролов;(812) 737-79-77;morozova.nika@kazakova.ru;\agents\agent_61.png;416
100;СофтМонтажХозСбыт;5;860932, Калужская область, город Наро-Фоминск, ул. Балканская, 78;5408216010;737659265;Харитонов Антонин Владимирович;(495) 396-23-64;zinaida90@filippov.org;\agents\agent_44.png;403
