;Наименование агента;Тип агента;Юридический адрес;ИНН;КПП;Директор;Телефон агента;Электронная почта агента;Логотип агента;Приоритет
1;СервисПив;1;840377, Рязанская область, город Щёлково, пл. Бухарестская, 42;6861024038;218034630;Никита Александрович Королёв;+7 (922) 325-12-93;znosov@vasilev.ru;;329
2;СантехСеверЛенМашина;2;606990, Новосибирская область, город Павловский Посад, въезд Домодедовская, 38;3506691089;830713603;Павел Максимович Рожков;(812) 214-73-94;pgorbacev@vasilev.net;\agents\agent_99.png;201
3;ЭлектроРемОрионЛизинг;3;594365, Ярославская область, город Павловский Посад, бульвар Космонавтов, 64;1340072597;500478249;Тарасова Дан Львович;(495) 513-93-16;anfisa.fedotova@tvetkov.ru;\agents\agent_93.png;198
4;РыбАлмазГаражСнаб;3;278792, Воронежская область, город Люберцы, ул. Космонавтов, 07;2135119617;916748563;Власов Ян Львович;(35222) 46-54-74;diana.gorbunov@gromov.ru;\agents\agent_29.png;50
5;CибБашкирТекстиль;4;429540, Мурманская область, город Воскресенск, пл. Славы, 36;7392007090;576103661;Григорий Владимирович Елисеева;(35222) 92-28-68;vzimina@zdanova.com;\agents\agent_94.png;218
6;ЮпитерТяжОрионЭкспедиция;5;960726, Томская область, город Орехово-Зуево, въезд 1905 года, 51;6843174002;935556458;Валерий Евгеньевич Виноградов;(812) 819-51-58;gblokin@orlov.net;\agents\agent_69.png;446
7;КазаньТекстиль;5;231891, Челябинская область, город Шатура, бульвар Ладыгина, 40;4584384019;149680499;Александров Бронислав Максимович;+7 (922) 936-37-67;osimonova@andreeva.com;\agents\agent_72.png;156
8;МясИнфоМясТраст;5;873144, Курская область, город Талдом, проезд Домодедовская, 46;6387079446;113956342;Лихачёваа Оксана Романовна;(812) 375-59-29;dgulyev@krasilnikov.ru;\agents\agent_43.png;16
9;АвтоТомскЦементЦентр;4;282009, Вологодская область, город Красногорск, пл. Домодедовская, 14;8317739640;940326934;Леонид Иванович Афанасьева;(35222) 24-98-18;kabanov.valentina@subbotina.ru;\agents\agent_40.png;71
10;Радио;6;798718, Ленинградская область, город Пушкино, бульвар Балканская, 37;9077613654;657690787;Эмма Андреевна Колесникова;(35222) 84-44-92;rtretykova@kozlov.ru;\agents\agent_68.png;221
11;ДизайнФинансМикро;5;775051, Иркутская область, город Серебряные Пруды, спуск Домодедовская, 41;2700182907;141912770;Кузьма Борисович Королёва;(495) 223-67-97;varvara15@belousov.ru;;462
12;Креп;3;336489, Калининградская область, город Можайск, наб. Славы, 35;4880732317;258673591;Назар Алексеевич Григорьева;(495) 315-25-86;savina.dominika@belousova.com;\agents\agent_64.png;371
13;ЖелДорДизайнМетизТраст;6;170549, Сахалинская область, город Видное, проезд Космонавтов, 89;7669116841;906390137;Игорь Львович Агафонова;8-800-692-72-18;lnikitina@kulikova.com;;290
14;Асбоцемент;2;030119, Курганская область, город Дмитров, пер. Славы, 47;1261407459;745921890;Никитинаа Антонина Андреевна;(812) 152-28-78;antonin19@panfilov.ru;\agents\agent_59.png;273
15;Мобайл;6;273144, Калужская область, город Наро-Фоминск, бульвар Чехова, 70;3655195522;395816585;Горшков Кузьма Фёдорович;(495) 532-54-42;rafail22@orlov.ru;\agents\agent_53.png;40
16;ТекстильУралАвтоОпт;3;028936, Магаданская область, город Видное, ул. Гагарина, 54;3930950057;678529397;Алина Сергеевна Дьячковаа;(495) 418-67-55;hkononova@pavlova.ru;\agents\agent_97.png;176
17;Башкир;1;513065, Рязанская область, город Одинцово, шоссе Славы, 93;3105334340;117513650;Одинцова Розалина Дмитриевна;8-800-656-63-99;iskra.sergeev@zykov.com;\agents\agent_33.png;35
18;ГорДор;4;376483, Калужская область, город Сергиев Посад, ул. Славы, 09;7088187045;440309946;Нонна Львовна Одинцоваа;(812) 364-46-64;maiy12@koklov.net;\agents\agent_77.png;175
19;Компания Рос;2;479740, Оренбургская область, город Наро-Фоминск, наб. Будапештсткая, 36;5502989807;518320454;Алёна Ивановна Тимофеева;(35222) 32-99-94;odenisov@knyzeva.ru;;252
20;КазЮпитерТомск;5;393450, Тульская область, город Кашира, пр. 1905 года, 47;9201745524;510248846;Рафаил Андреевич Копылов;(35222) 24-85-54;tgavrilov@frolov.ru;\agents\agent_85.png;244
21;СеверГаз;6;509479, Орловская область, город Павловский Посад, спуск Бухарестская, 28;7908427926;249521550;Валериан Андреевич Кириллова;(812) 973-88-81;smukina@evseev.com;\agents\agent_15.png;83
22;Компания КазАлмаз;2;848810, Кемеровская область, город Лотошино, пер. Ломоносова, 90;3084797352;123190924;Марк Фёдорович Муравьёва;+7 (922) 692-21-57;irina.gusina@vlasova.ru;\agents\agent_105.png;396
23;ЦементАсбоцементОрионТраст;5;221534, Орловская область, город Серебряные Пруды, проезд Гагарина, 54;2972154471;668972219;Павлова Марк Александрович;(495) 979-36-66;igulyeva@kostina.ru;\agents\agent_28.png;441
24;Компания Электро;2;183744, Рязанская область, город Клин, въезд Косиора, 29;4335399269;780051451;Кабанов Кирилл Максимович;(35222) 63-92-83;blokin.sofiy@terentev.ru;\agents\agent_41.png;340
25;БашкирЮпитерТомск;3;035268, Сахалинская область, город Волоколамск, проезд Ладыгина, 51;1606315697;217799345;Фадеева Раиса Александровна;(812) 395-91-75;dyckov.veniamin@kotova.ru;\agents\agent_84.png;139
26;ОрионВектор;3;138159, Свердловская область, город Подольск, спуск Балканская, 72;5687675108;816451597;Алексей Борисович Семёнова;+7 (922) 456-59-29;subbotin.rostislav@zueva.org;\agents\agent_22.png;496
27;Рос;1;412597, Калужская область, город Клин, пр. Гагарина, 57;6729448041;935241906;Никифороваа Рената Сергеевна;+7 (922) 822-88-76;potapov.abram@trofimova.org;\agents\agent_36.png;158
28;ДизайнВосток;4;680394, Оренбургская область, город Павловский Посад, спуск Косиора, 50;6222265808;245694799;Добрыня Сергеевич Кабанов;+7 (922) 767-84-15;efimova.timofei@tretykova.ru;\agents\agent_17.png;188
29;РемГаражЛифт;5;048715, Ивановская область, город Люберцы, проезд Космонавтов, 89;1656477206;988968838;Филатов Владимир Максимович;(35222) 18-85-61;novikova.gleb@sestakov.ru;\agents\agent_90.png;374
30;ПивГлав;2;244290, Астраханская область, город Талдом, проезд Космонавтов, 17;3090235456;870818930;Клим Иванович Юдин;8-800-153-74-46;sofiy.bolsakov@isakova.ru;\agents\agent_27.png;329
31;Компания Гараж;2;395101, Белгородская область, город Балашиха, бульвар 1905 года, 00;6190244524;399106161;Владлена Фёдоровна Ларионоваа;(35222) 22-47-12;asiryeva@andreeva.com;\agents\agent_91.png;413
32;Монтаж;1;066594, Магаданская область, город Шаховская, спуск Сталина, 59;6142194281;154457435;Блохина Сергей Максимович;(495) 783-36-97;zakar.sazonova@gavrilov.ru;\agents\agent_66.png;300
33;ВодГараж;5;988899, Саратовская область, город Раменское, пр. Славы, 40;5575072431;684290320;Лаврентий Фёдорович Логинова;(35222) 11-75-66;pmaslov@fomiceva.com;\agents\agent_92.png;250
34;Компания Метал;2;908229, Иркутская область, город Истра, бульвар Бухарестская, 97;9933367989;856443865;Валентина Ивановна Громова;(35222) 99-39-28;vasileva.tatyna@lebedeva.net;\agents\agent_16.png;167
35;Бум;1;409600, Новгородская область, город Ногинск, пл. Гагарина, 68;1953785418;122905583;Татьяна Сергеевна Королёваа;+7 (922) 282-82-91;belova.vikentii@konstantinova.net;\agents\agent_103.png;82
36;Гор;6;245009, Белгородская область, город Коломна, шоссе Домодедовская, 93;6196739969;784512010;Адриан Александрович Одинцов;(812) 327-52-23;rostislav.savelev@dmitrieva.ru;\agents\agent_46.png;85
37;МясРеч;3;903648, Калужская область, город Воскресенск, пр. Будапештсткая, 91;9254261217;656363498;Белоусоваа Ирина Максимовна;(812) 256-74-95;bkozlov@volkov.ru;\agents\agent_83.png;355
38;МясТрансМоторЛизинг;5;765320, Ивановская область, город Шатура, спуск Гоголя, 88;6148685143;196332656;Тамара Дмитриевна Семёноваа;(495) 489-75-57;vlad.sokolov@andreev.org;\agents\agent_87.png;268
39;Компания ТелекомХмельГаражПром;2;126668, Ростовская область, город Зарайск, наб. Гагарина, 69;1614623826;824882264;Костина Татьяна Борисовна;8-800-617-13-37;qkolesnikova@kalinina.ru;\agents\agent_96.png;457
40;МетизТехАвтоПроф;2;713016, Брянская область, город Подольск, пл. Домодедовская, 93;2988890076;215491048;Егор Фёдорович Третьякова;8-800-192-74-77;anastasiy.gromov@samsonova.com;\agents\agent_58.png;321
41;РосАвтоМонтаж;2;331914, Курская область, город Ногинск, спуск Ладыгина, 66;4735043946;263682488;Диана Алексеевна Исаковаа;8-800-468-91-51;lapin.inessa@isaeva.com;\agents\agent_80.png;10
42;Компания КрепГаз;2;415525, Воронежская область, город Орехово-Зуево, спуск Ленина, 14;2910821636;169856199;Эмилия Фёдоровна Шилова;8-800-971-62-32;iturova@isakova.ru;\agents\agent_48.png;50
43;БухТеле;3;481781, Астраханская область, город Орехово-Зуево, спуск Ломоносова, 67;3547826061;581933218;Клавдия Романовна Савина;(35222) 89-78-68;vasilev.svetlana@saskov.org;\agents\agent_18.png;171
44;ТяжМяж;6;255489, Самарская область, город Озёры, ул. Ломоносова, 09;6391522710;209038885;Юлия Львовна Горбунова;(812) 425-28-46;bzykov@baranov.com;\agents\agent_55.png;472
45;Тех;5;731935, Калининградская область, город Павловский Посад, наб. Гагарина, 59;9282924869;587356429;Аким Романович Логинова;+7 (922) 113-94-49;vasilisa99@belyev.ru;\agents\agent_86.png;278
46;ГлавITФлотПроф;1;447811, Мурманская область, город Егорьевск, ул. Ленина, 24;2561361494;525678825;Зыкова Стефан Максимович;(35222) 33-48-16;savva.rybov@kolobov.ru;\agents\agent_89.png;62
47;Восток;1;284236, Воронежская область, город Павловский Посад, бульвар Ленина, 28;8929775900;788028687;Савинаа Нина Александровна;(495) 227-66-48;nsitnikova@tikonova.org;;380
48;ТелекомЮпитер;4;959793, Курская область, город Егорьевск, бульвар Ленина, 72;9383182378;944520594;Калинина Татьяна Ивановна;(812) 798-33-53;kulikov.adrian@zuravlev.org;\agents\agent_106.png;302
49;МонтажВекторМобайлЦентр;3;094869, Ленинградская область, город Ступино, наб. Ленина, 80;4433392652;757806909;Захар Александрович Панова;(495) 566-98-62;pavel.davydova@tretykov.net;\agents\agent_32.png;372
50;ВостокГлав;2;217022, Ростовская область, город Озёры, ул. Домодедовская, 19;3580946305;405017349;Инга Фёдоровна Дмитриева;+7 (922) 329-34-28;gordei95@kirillov.ru;\agents\agent_88.png;107
51;Компания КрепЦемент;2;423477, Мурманская область, город Кашира, бульвар Домодедовская, 61;3025099903;606083992;Екатерина Львовна Суворова;8-800-628-79-67;rusakov.efim@nikiforov.ru;\agents\agent_75.png;426
52;ЖелДор;3;860124, Иркутская область, город Егорьевск, пер. Гагарина, 67;9392505809;911026119;Симоноваа Лариса Борисовна;(35222) 26-55-64;karitonova.fedosy@vasileva.net;\agents\agent_51.png;429
53;Компания Хмель;2;889757, Новосибирская область, город Раменское, бульвар 1905 года, 93;9004087602;297273898;Владимир Борисович Суворова;(35222) 27-19-66;ermakov.mark@isakova.ru;\agents\agent_67.png;2
54;Цемент;2;084315, Амурская область, город Шаховская, наб. Чехова, 62;9662118663;650216214;Анфиса Фёдоровна Буроваа;+7 (922) 859-19-97;panova.klementina@bobrov.ru;\agents\agent_79.png;340
55;ЛенМобайлМикро;1;737175, Ростовская область, город Одинцово, ул. Космонавтов, 99;6729041572;828657559;Изабелла Евгеньевна Дьячкова;(35222) 96-34-97;frolov.artem@zuravlev.ru;\agents\agent_52.png;341
56;Компания ТверьДизайн;2;672492, Калининградская область, город Москва, проезд Сталина, 64;3567301661;623881311;Доминика Александровна Никитинаа;8-800-234-93-22;ypotapov@kolesnikova.ru;\agents\agent_37.png;271
57;ВодТверьХозМашина;3;145030, Сахалинская область, город Шатура, въезд Гоголя, 79;4174253174;522227145;Александра Дмитриевна Ждановаа;(495) 756-36-72;tkrylov@baranova.net;\agents\agent_81.png;8
58;ТелеГлавВекторСбыт;3;062489, Челябинская область, город Пушкино, въезд Бухарестская, 07;9504787157;419758597;Екатерина Фёдоровна Ковалёва;+7 (922) 619-91-52;nsitnikov@kovaleva.ru;\agents\agent_56.png;185
59;БашкирИнжКрепСбыт;2;191420, Новосибирская область, город Ногинск, пер. Будапештсткая, 28;6771467761;977595370;Алиса Фёдоровна Архипова;+7 (922) 495-46-18;vlad.molcanov@fomicev.ru;\agents\agent_24.png;475
60;ТрансТверь;4;818676, Томская область, город Павловский Посад, ул. Ладыгина, 27;3311036393;590018934;Алина Романовна Овчинникова;(35222) 22-74-12;dorofeev.milan@vorobeva.net;\agents\agent_25.png;495
61;ТелеСеверМикро;4;046300, Орловская область, город Ступино, бульвар Бухарестская, 13;9534974527;344691556;Селезнёв Василий Евгеньевич;(35222) 66-26-65;koseleva.ylii@potapov.ru;\agents\agent_12.png;254
62;CибПивОмскСнаб;3;816260, Ивановская область, город Москва, ул. Гагарина, 31;5676173945;256512286;Людмила Александровна Сафонова;(812) 743-49-87;evorontova@potapova.ru;;477
63;ЛенБухМикро-H;1;078797, Мурманская область, город Коломна, пр. Гоголя, 94;5943902570;103426359;Субботин Герасим Владимирович;(812) 421-59-75;rybov.tatyna@merkuseva.com;\agents\agent_30.png;242
64;ЮпитерЛенГараж-М;4;339507, Московская область, город Видное, ул. Космонавтов, 11;2038393690;259672761;Васильева Валерия Борисовна;(812) 229-34-18;larkipova@gorbunov.ru;\agents\agent_73.png;470
65;МорВостокТомскПром;5;034623, Белгородская область, город Павловский Посад, проезд Ломоносова, 72;4082127026;544686044;Гавриил Евгеньевич Селиверстов;+7 (922) 258-96-16;lev.efremov@frolov.ru;\agents\agent_20.png;198
66;Компания ФинансСервис;2;841700, Брянская область, город Серпухов, спуск Домодедовская, 35;7491491391;673621812;Клавдия Сергеевна Виноградова;8-800-358-54-99;robert.serbakov@safonova.ru;\agents\agent_63.png;395
67;Метиз;2;455463, Ярославская область, город Серпухов, пер. Бухарестская, 01;4433116074;949226221;Ян Иванович Егоров;(35222) 81-78-92;mersova@rodionova.ru;\agents\agent_54.png;168
68;ФлотБух;4;741647, Ульяновская область, город Наро-Фоминск, ул. 1905 года, 11;4868711532;409331823;Муравьёваа Мария Дмитриевна;+7 (922) 155-75-21;tkuznetova@sukanova.ru;\agents\agent_21.png;385
69;КазХоз;5;384162, Астраханская область, город Одинцово, бульвар Гагарина, 57;6503377671;232279972;Степанова Роман Иванович;8-800-955-44-52;istrelkova@fomin.ru;;213
70;Орион;6;951035, Ивановская область, город Ступино, шоссе Космонавтов, 73;2670166502;716874456;Мартынов Михаил Борисович;(35222) 58-77-96;aleksei63@kiselev.ru;\agents\agent_102.png;166
71;РечИнж;5;862241, Кемеровская область, город Москва, пер. Славы, 63;9289300952;534867576;Донат Иванович Кудрявцев;(812) 971-47-98;qloginova@antonov.com;\agents\agent_8.png;426
72;РосПивТверь;5;053965, Магаданская область, город Видное, наб. Балканская, 41;2857470864;732899890;Люся Фёдоровна Горшковаа;+7 (922) 692-73-72;vitalii.melnikov@kopylov.com;\agents\agent_11.png;368
73;КрепТелекомТекстильМашина;1;754514, Тверская область, город Люберцы, пл. Домодедовская, 84;7626613684;187506967;Богданов Денис Максимович;+7 (922) 278-54-95;ignatov.adam@kononova.org;\agents\agent_39.png;259
74;МорГлавМонтажЭкспедиция;5;313619, Читинская область, город Чехов, ул. Ленина, 38;8619846965;796144573;Анастасия Львовна Субботинаа;(812) 161-96-49;flukin@moiseeva.com;\agents\agent_34.png;329
75;ТекстильУралВод;6;872673, Ярославская область, город Видное, спуск Славы, 04;8336124514;871193263;Эльвира Фёдоровна Герасимова;(495) 614-67-93;obespalov@alekseev.org;\agents\agent_9.png;28
76;Газ;1;252821, Тамбовская область, город Пушкино, ул. Чехова, 40;8876413796;955381891;Терентьев Илларион Максимович;8-800-278-78-32;ulyna.antonov@noskov.ru;\agents\agent_101.png;170
77;ТомскТранс;2;271624, Свердловская область, город Озёры, ул. Косиора, 21;6523850838;970092830;Архипова Юрий Дмитриевич;(35222) 66-22-46;antonina.krasilnikov@nikonov.ru;\agents\agent_47.png;427
78;Компания ТехТеле;2;285256, Магаданская область, город Дмитров, шоссе Ладыгина, 20;1553744119;713327632;Тихонова Валериан Владимирович;8-800-943-36-45;anfisa63@sobolev.ru;\agents\agent_42.png;465
79;СофтИнжIT;5;146295, Тверская область, город Одинцово, въезд Бухарестская, 78;2368693812;791368408;Виктор Львович Михайлова;8-800-319-27-45;yliy.efimov@zdanova.ru;\agents\agent_50.png;460
80;Компания Монтаж;2;036381, Брянская область, город Кашира, бульвар Гагарина, 76;6206428565;118570048;Силин Даниил Иванович;(495) 626-86-13;afanasev.anastasiy@muravev.ru;\agents\agent_100.png;124
81;СтройГорНефть;5;444539, Ульяновская область, город Лотошино, спуск Будапештсткая, 95;5916775587;398299418;Тарасова Макар Максимович;(495) 852-82-84;lysy.kolesnikova@molcanova.com;\agents\agent_62.png;161
82;ЦементХмельОрионНаладка;5;014379, Кировская область, город Озёры, пр. Будапештсткая, 28;2118874929;482607758;Максим Евгеньевич Гурьева;+7 (922) 419-14-19;daniil.selezneva@safonova.com;\agents\agent_49.png;61
83;Компания ОрионСтройЛифт;2;819305, Воронежская область, город Талдом, шоссе Ломоносова, 36;8834229587;958311664;Щукина Искра Максимовна;8-800-381-59-97;artemii.abramova@arkipov.ru;;467
84;Тяж;1;650482, Смоленская область, город Коломна, проезд Косиора, 95;5484904441;943388774;Белов Влад Александрович;+7 (922) 547-77-52;rodionova.ulyna@noskov.ru;\agents\agent_35.png;207
85;ЦементАсбоцемент;3;619540, Курская область, город Раменское, пл. Балканская, 12;4345774724;352469905;Воронова Мария Александровна;+7 (922) 133-68-96;polykov.veronika@artemeva.ru;\agents\agent_76.png;426
86;ГазДизайнЖелДор;4;695230, Курская область, город Красногорск, пр. Гоголя, 64;2396029740;458924890;Лев Иванович Третьяков;(35222) 39-88-91;elizaveta.komarov@rybakov.net;\agents\agent_74.png;236
87;РемСантехОмскБанк;5;289468, Омская область, город Видное, пер. Балканская, 33;6823050572;176488617;Фокина Искра Максимовна;(35222) 76-15-56;anisimov.mark@vorobev.ru;\agents\agent_82.png;442
88;Мясо;1;252821, Тамбовская область, город Пушкино, ул. Чехова, 40;1876413796;955381891;Терентьев Илларион Максимович;+7 (922) 315-51-42;ulyna.antonov@noskov.ru;\agents\agent_107.png;170
89;КрепГаражСантехМаш;6;207204, Пензенская область, город Одинцово, пер. Гагарина, 80;7574946061;146206755;Аркадий Романович Тихонов;(495) 172-31-91;vladlen84@ersova.net;\agents\agent_10.png;330
90;ИнжITЖелДор-H;1;019291, Вологодская область, город Клин, ул. Космонавтов, 96;8103088511;604606043;Колесникова Август Владимирович;(495) 324-18-82;karitonov.aleksandra@samoilov.com;\agents\agent_14.png;129
91;Рем;3;707812, Иркутская область, город Шаховская, ул. Гагарина, 17;3203830728;456254820;Шароваа Елизавета Львовна;(35222) 46-69-69;zanna25@nikiforova.com;\agents\agent_104.png;329
92;ФинансТелеТверь;6;687171, Томская область, город Лотошино, пл. Славы, 59;2646091050;971874277;Зайцеваа Дарья Сергеевна;(495) 839-58-56;medvedev.klim@afanasev.com;\agents\agent_70.png;100
93;Строй;1;763019, Омская область, город Шатура, пл. Сталина, 56;6678884759;279288618;Кудрявцев Адриан Андреевич;+7 (922) 129-57-13;soloveva.adam@andreev.ru;\agents\agent_57.png;12
